date,username,to,replies,retweets,favorites,text,geo,mentions,hashtags,id,permalink
2020-06-04 23:15:03,GirlsLoveBaseba,,0,0,0,"Why does everybody look like @morningmika or @JoeNBC or @WillieGeist on #morningjoe ? #BlackLivesMatter",,@morningmika @JoeNBC @WillieGeist,#morningjoe #BlackLivesMatter,1268682709557063682,https://twitter.com/GirlsLoveBaseba/status/1268682709557063682
2020-06-04 23:15:03,projectwayfindr,,0,1,4,"Wayfinder has curated a free abridged version of our Belonging Check-In Kit to encourage #educators to reflect on and process this moment in history together with your students. YOU CAN DOWNLOAD THE FULL KIT HERE: https://www. projectwayfinder.com/anti-racism-re sources … #BlackLivesMatter #JusticeForGeorgeFloyd pic.twitter.com/AZ563CtlwK",,,#educators #BlackLivesMatter #JusticeForGeorgeFloyd,1268682707971657728,https://twitter.com/projectwayfindr/status/1268682707971657728
2020-06-04 23:15:03,Sybil4America,josecanyousee,0,0,0,"7minutes worth your time. @KamalaHarris rebuke to Paul Rand on the definition and history of lynching in this country. True, heart felt and very sad. @RandPaul is a despicable being. #BlackLivesMatter #1MillionDCSaturday be there and be heard. #GeorgeFloyd https:// twitter.com/josecanyousee/ status/1268640245706186752 …",,@KamalaHarris @RandPaul,#BlackLivesMatter #1MillionDCSaturday #GeorgeFloyd,1268682707732697088,https://twitter.com/Sybil4America/status/1268682707732697088
2020-06-04 23:15:02,bubbahyunjin,MichelleGreen20,1,0,0,"People I know who wouldn't break the chain @DaisyRenteria4 @auds_dal19 @tigerlord227 #blacklivesmatter",,@DaisyRenteria4 @auds_dal19 @tigerlord227,#blacklivesmatter,1268682705329426432,https://twitter.com/bubbahyunjin/status/1268682705329426432
2020-06-04 23:15:02,Sleepless_Jack,,0,0,0,"I made this for you. Doing better everyday to see a different, better world. Hopefully it’ll shine some good and we can wear them together. #blacklivesmatter #dogood #illustration #shoplocalky #love #together … https://www. instagram.com/p/CBB_9d6F-XC/ ?igshid=g7mtz7bmcm99 …",,,#blacklivesmatter #dogood #illustration #shoplocalky #love #together,1268682704851283971,https://twitter.com/Sleepless_Jack/status/1268682704851283971
2020-06-04 23:15:02,Aliyussufiy,,0,0,2,"Time to read some Baldwin(s). #BlackLivesMatter pic.twitter.com/yL2kFBi4ld",,,#BlackLivesMatter,1268682704331169795,https://twitter.com/Aliyussufiy/status/1268682704331169795
2020-06-04 23:15:02,YoSoyAirwrek,ComplexSports,0,0,0,"Sooo when they’re white they’re “a good Christian man” and he has worth but when it’s LeBron and KD it’s, shut up and dribble? Funny how the narrative changed REAL QUICK #BlackLivesMatter #SaveBlackLives https:// twitter.com/complexsports/ status/1268551040074383361 …",,,#BlackLivesMatter #SaveBlackLives,1268682702947078144,https://twitter.com/YoSoyAirwrek/status/1268682702947078144
2020-06-04 23:15:01,BasnikSoler,,0,0,0,"Cars being taken off 6th ave to moniter group near 39th st #NYCScannerDuty #nycprotests #blacklivesmatter",,,#NYCScannerDuty #nycprotests #blacklivesmatter,1268682702179500032,https://twitter.com/BasnikSoler/status/1268682702179500032
2020-06-04 23:15:01,slieesh,,0,1,1,"If your problem is colour then fuck you because #BlackLivesMatter a lot, as a matter fact, you can't survive without black, so deal with it or you fuck off",,,#BlackLivesMatter,1268682701386678272,https://twitter.com/slieesh/status/1268682701386678272
2020-06-04 23:15:01,mochi_mitch,,0,0,1,"Sorry I’ve been so inactive! I’m fine! :) I’m taking this time to attend protests, donate, and share important information regarding the #BlackLivesMatter movement which is far beyond a “trend” or a “moment”. I’m glad to be part of such an open, accepting fan base.",,,#BlackLivesMatter,1268682698882551810,https://twitter.com/mochi_mitch/status/1268682698882551810
2020-06-04 23:15:00,MollieCahillane,,0,0,1,"thousands marching down Halsted #blacklivesmatter pic.twitter.com/hFdcKPAIra",,,#blacklivesmatter,1268682698001993729,https://twitter.com/MollieCahillane/status/1268682698001993729
2020-06-04 23:15:00,TheLawi2,,0,0,1,"The @nytimes an accessory for racist hate and oppression. There’s no explaining that away. Have you seen how they report black issues and especially, Africa? #Blacklivesmatter #NoJusticeNoPeace #JusticeForGeorgeFloyd",,@nytimes,#Blacklivesmatter #NoJusticeNoPeace #JusticeForGeorgeFloyd,1268682697666433027,https://twitter.com/TheLawi2/status/1268682697666433027
2020-06-04 23:15:00,4cast4you,,0,2,3,"“I am deaf, but I hear your cries. I have anxiety, but I stand with the crowd. I am autistic and I have a hard time understanding things, but I understand that we need to change. What’s your excuse?” #BlackLivesMatter STORY --> https://www. westernmassnews.com/news/final-spr ingfield-protester-leaves-after-17-hours/article_41dd6b22-a67a-11ea-8052-1ffd7a69872a.html … pic.twitter.com/nDpyFXD3Kf",,,#BlackLivesMatter,1268682695560712197,https://twitter.com/4cast4you/status/1268682695560712197
2020-06-04 23:15:00,c895radio,,1,0,1,"Want to show your support for #BlackLivesMatter and our incredible community? We created this graphic for our listeners to repost, print out and even COLOR! http:// C895.org/ColorWithC895 pic.twitter.com/Cob3G4jZbI",,,#BlackLivesMatter,1268682695522938880,https://twitter.com/c895radio/status/1268682695522938880
2020-06-04 23:15:00,merchguysteve,,0,0,0,"Alright, going to continue the charity stream in a few minutes with some Crash Bandicoot Trilogy. A Reminder that we're raising funds for @bailproject in support of #BlackLivesMatter . I love y'all, and I'll catch you over at https:// twitch.tv/merchguysteve in a few",,@bailproject,#BlackLivesMatter,1268682695435063296,https://twitter.com/merchguysteve/status/1268682695435063296
2020-06-04 23:15:00,AutumnTheAries,,0,1,1,"Autumn ended Szn 2 of the #LitLifePodcast with a BANG! Fellow #Podcaster @PenroseEames came through with OH/MI beef, the HARDEST #STFUAward ever, talks about having a crush, and speaks on his #StrainOfTheWeek . You don't want to miss this! #PodsInColor #BlackLivesMatter #ATL pic.twitter.com/cFqNAkS8M8",,@PenroseEames,#LitLifePodcast #Podcaster #STFUAward #StrainOfTheWeek #PodsInColor #BlackLivesMatter #ATL,1268682695430696960,https://twitter.com/AutumnTheAries/status/1268682695430696960
2020-06-04 23:15:00,DStitch3101,,0,0,0,"We Japanese must not disregard the problem. We should know more about the problem. I hope that things return to normal as soon as possible. #BlackLivesMatter pic.twitter.com/iL4n8H1iCn",,,#BlackLivesMatter,1268682694952488961,https://twitter.com/DStitch3101/status/1268682694952488961
2020-06-04 23:14:59,Radicaleptomy,katiepa49612786,0,0,0,"I said K-Pop is ""slightly better"", not ""slightly worse"" than the promotion of a hash-tag that purports to be a cynical answer to #blacklivesmatter . Also, I wasn't being serious. Also, K-Pop is clearly winning anyway, it now appears to represent about 40% of all Internet content.",,,#blacklivesmatter,1268682691550961665,https://twitter.com/Radicaleptomy/status/1268682691550961665
2020-06-04 23:14:58,AnimationisKey,,0,0,0,"If you don't know where to start, then this got you covered. #BlackLivesMatter pic.twitter.com/az14ukNYb0",,,#BlackLivesMatter,1268682689961504770,https://twitter.com/AnimationisKey/status/1268682689961504770
2020-06-04 23:14:58,arct0zolt,,0,0,0,"DEMAND JUSTICE for BREONNA TAYLOR - Sign the Petition! http:// chng.it/mzCpDmYG Innocent, unarmed and shot 8 times by police in her own home. #blacklivesmatter",,,#blacklivesmatter,1268682687985799169,https://twitter.com/arct0zolt/status/1268682687985799169
2020-06-04 23:14:58,FuhCup,,0,0,1,"THIS IS WHY I PROTEST THIS IS WHY I WONT BE SILENT THIS IS WHAT I FIGHT TO CHANGE EVERYDAY #BlackLivesMatter #whitesilenceiswhiteviolence #enoughisenough #NoJusticeNoPeaceProsecuteThePolice pic.twitter.com/15pkbY29IH",,,#BlackLivesMatter #whitesilenceiswhiteviolence #enoughisenough #NoJusticeNoPeaceProsecuteThePolice,1268682687377600513,https://twitter.com/FuhCup/status/1268682687377600513
2020-06-04 23:14:56,musicdisc13,lovelypxris,1,0,0,"but the #BlackLivesMatter is okay? if we were all human people would treat both hashtags the same, or use #AllLivesMattter .",,,#BlackLivesMatter #AllLivesMattter,1268682680717045760,https://twitter.com/musicdisc13/status/1268682680717045760
2020-06-04 23:14:56,HottieMinksLTD,,0,0,0,"Don’t forget to take care of yourself during these trying times. We’re in this together. #unapologeticallyblack #blacklivesmatter #selflove https://www. instagram.com/p/CBB_8rmp_7X/ ?igshid=15caro0lbwc5b …",,,#unapologeticallyblack #blacklivesmatter #selflove,1268682680243113984,https://twitter.com/HottieMinksLTD/status/1268682680243113984
2020-06-04 23:14:55,d_mak111,,0,0,0,"Let me get this straight... So basically we're saying ""End Racism"" And there are people saying... ""We hear you. But..."" What nonsense is this? #BlackLivesMatterSA #BlackLivesMatter",,,#BlackLivesMatterSA #BlackLivesMatter,1268682675709231105,https://twitter.com/d_mak111/status/1268682675709231105
2020-06-04 23:14:55,darren_cahill,CocoGauff,0,0,19,"Well done Coco. Wise, brave and talented well beyond your years. It’s an honour for us to have someone like you represent our sport in standing up and speaking out. Stand tall always. #blacklivesmatter https:// twitter.com/cocogauff/stat us/1268358538549768192 …",,,#blacklivesmatter,1268682675293806593,https://twitter.com/darren_cahill/status/1268682675293806593
2020-06-04 23:14:55,timmins1989,lsanger,0,0,0,"Judging by all the new information that has come out about the police man knowing George and working together with him before, can this really be classed as racism? This had to be personal. Mad how one thing spun a certain way has sparked a worldwide movement #BlackLivesMatter https:// twitter.com/lsanger/status /1267841349740625923 …",,,#BlackLivesMatter,1268682675193294857,https://twitter.com/timmins1989/status/1268682675193294857
2020-06-04 23:14:54,EichenlaubLuke,PTCreeperKiller,0,0,0,"I do hope we get the full national dex sometime in the future. But it's not worth throwing a temper tantrum about, and the people who do are idiots. With that being said #BlackLivesMatter",,,#BlackLivesMatter,1268682672777375745,https://twitter.com/EichenlaubLuke/status/1268682672777375745
2020-06-04 23:14:54,CrisBenincaPhD,simonenardin,0,0,0,"What can I say about this! My heart is broken! Bad people everywhere! #JusticeforMiguel #justicapormiguel #BlackLivesMatter https:// twitter.com/simonenardin/s tatus/1268668858157748231 …",,,#JusticeforMiguel #justicapormiguel #BlackLivesMatter,1268682672110366721,https://twitter.com/CrisBenincaPhD/status/1268682672110366721
2020-06-04 23:14:54,MlsOhio,,0,0,0,"Shop owners defend themselves from gang members trying to destroy their livelihood: https:// youtu.be/1Pwl4pvr300 Female Reporter: Is that an uzi? Does he have an Uzi? Isnt that illegal? Male Reporter: I don’t think they really care right now, Karen #blm #blacklivesmatter #bluefall",,,#blm #blacklivesmatter #bluefall,1268682671749836800,https://twitter.com/MlsOhio/status/1268682671749836800
2020-06-04 23:14:53,editorbrian,,0,0,0,"Change requires uncomfortable conversations. Video from today's ""Solidarity Rally for Black Lives"" in Somers, New York, a predominantly white community where black people make up 1.2 percent of the population. #blacklivesmatter #GeorgeFloydProstests https://www. youtube.com/watch?v=2D3fDg JnNSI …",,,#blacklivesmatter #GeorgeFloydProstests,1268682667320582145,https://twitter.com/editorbrian/status/1268682667320582145
2020-06-04 23:14:53,715amcoffee,YourAnonCentral,0,0,0,"We need a global revolution, no borders, universal income, no races, no hate, no filthy rich, no poor, no starvation, no governments, no banks, no intelligence agencies, no wars. #Anonymous #blacklivesmatter #NoJusticeNoPeace",,,#Anonymous #blacklivesmatter #NoJusticeNoPeace,1268682665219293185,https://twitter.com/715amcoffee/status/1268682665219293185
2020-06-04 23:14:52,IamJdRebel,,0,0,0,"This is just a nanosecond of justice. Much more work still needs to be done. I don't matter until #BLACKLIVESMATTER",,,#BLACKLIVESMATTER,1268682664904622081,https://twitter.com/IamJdRebel/status/1268682664904622081
2020-06-04 23:14:52,Coier85,decolonize_this,0,0,0,"DISARM, DEFUND, DISBAND THE POLICE NOW! #ACAB #BLACKLIVESMATTER #IAmAntifa",,,#ACAB #BLACKLIVESMATTER #IAmAntifa,1268682663285719048,https://twitter.com/Coier85/status/1268682663285719048
2020-06-04 23:14:52,NABACentral,,0,1,0,"We will continue to galvanize our resources and talent to build effective solutions within our community. ICYMI: We have published a comprehensive database of Resources for Black People https:// linktr.ee/nabanational #naba #liftingasweclimb #blacklivesmatter #savingourcommunities pic.twitter.com/rCNIalXOm6",,,#naba #liftingasweclimb #blacklivesmatter #savingourcommunities,1268682662996332545,https://twitter.com/NABACentral/status/1268682662996332545
2020-06-04 23:14:52,reallyRenita,Alyssa_Milano,0,0,0,"We need to keep reposting this until he gets his apology and check for lost wages. While @Kaepernick7 was kneeling I was supporting him by refusing to stand at games for racial injustice. #BlackLivesMatter https:// twitter.com/alyssa_milano/ status/1268313855806984193 …",,@Kaepernick7,#BlackLivesMatter,1268682662094528514,https://twitter.com/reallyRenita/status/1268682662094528514
2020-06-04 23:14:52,_JadeeKiss,,1,0,0,"So my friend @summerrraynee and I went to protest this morning. #blacklivesmatter Before we left, she put her brownie in a decorative bowl on my dining table. We left",,@summerrraynee,#blacklivesmatter,1268682662086049794,https://twitter.com/_JadeeKiss/status/1268682662086049794
2020-06-04 23:14:51,holly46732255,pjimindipityy,0,0,0,"#BLACKLIVESMATTER no justice. no peace.",,,#BLACKLIVESMATTER,1268682660542590980,https://twitter.com/holly46732255/status/1268682660542590980
2020-06-04 23:14:51,rmbdraws,,0,0,0,"How many have you gone through?! Screenshot and circle them #BlackLivesMatter pic.twitter.com/zUk5r6YaI1",,,#BlackLivesMatter,1268682659942797312,https://twitter.com/rmbdraws/status/1268682659942797312
2020-06-04 23:14:51,newhau5,graphitti_girl,0,0,2,"No, he didn't need to specify which parts made him comfortable. He doesn't need to comfortable. Who gives a fuck which part he supports or doesn't, he's a white multi-millionaire. PRIDE, America, Civil Rights Movement happened with riots. #BLACKLIVESMATTER is the response",,,#BLACKLIVESMATTER,1268682659041067009,https://twitter.com/newhau5/status/1268682659041067009
2020-06-04 23:14:51,BenWalksAway,,0,0,0,"Police response to having water thrown at them. #BlackLivesMatter pic.twitter.com/ufbvEnUlTD",,,#BlackLivesMatter,1268682658772480000,https://twitter.com/BenWalksAway/status/1268682658772480000
2020-06-04 23:14:51,maddibanani,LouMalnatis,0,0,0,"thank you for this reply. i appreciate you sharing this so we can see the full picture. i cannot support a business that doesn’t support #BlackLivesMatter , but i also do not support cancel culture. keep doing your part for this movement and making the best pizza!!",,,#BlackLivesMatter,1268682657568882688,https://twitter.com/maddibanani/status/1268682657568882688
2020-06-04 23:14:50,ZbeckXy,_puppi,0,0,0,"Retweet if you have more hours in a video game than police do in training. #blacklivesmatter https:// twitter.com/_puppi/status/ 1268658321042497536 …",,,#blacklivesmatter,1268682654607605763,https://twitter.com/ZbeckXy/status/1268682654607605763
2020-06-04 23:14:50,OGDefJef,CopWithAttitude,0,0,0,"#BlackLivesMatter was created after #TrayvonMartin was murdered. The person who kills obviously did not value the life that they took. Of course our lives matter to us. Its obvious. We expect protection from those sworn to do so. Serious answer.",,,#BlackLivesMatter #TrayvonMartin,1268682654528032774,https://twitter.com/OGDefJef/status/1268682654528032774
2020-06-04 23:14:50,paperhearts_jk,,1,3,5,"I made a donation in Jungkook’s name. Ways you can help: https:// blacklivesmatters.carrd.co We will stand together. #BlackLivesMatter pic.twitter.com/P9DwFYK3TU",,,#BlackLivesMatter,1268682653710143498,https://twitter.com/paperhearts_jk/status/1268682653710143498
2020-06-04 23:14:49,MamaSunfl0wer,,0,0,0,"Our protest in my city might have been small today, but the love and support we got from the community and showed to the community was completely worth it #BlackLivesMatter",,,#BlackLivesMatter,1268682648874037250,https://twitter.com/MamaSunfl0wer/status/1268682648874037250
2020-06-04 23:14:48,AnamKaraJoy,,0,0,0,"We made this in 2017. We need it to be heard now more than ever in 2020. “ #UntamedTongue "" Spoken Word Short Film https:// youtu.be/oCeQlc2ErR4 via @YouTube #BlackLivesMatter #ICantBreathe #DontShoot #StandTogether #SayTheirNames #RacismMustStop #RacismIsReal #NoJusticeNoPeace",,@YouTube,#UntamedTongue #BlackLivesMatter #ICantBreathe #DontShoot #StandTogether #SayTheirNames #RacismMustStop #RacismIsReal #NoJusticeNoPeace,1268682647930310658,https://twitter.com/AnamKaraJoy/status/1268682647930310658
2020-06-04 23:14:48,lalashoots,,0,0,0,"Silence is Oppression. #blacklivesmatter @Upper East Side https://www. instagram.com/p/CBB_7tVjKA1/ ?igshid=u7bim55wrfr8 …",,@Upper,#blacklivesmatter,1268682646290419712,https://twitter.com/lalashoots/status/1268682646290419712
2020-06-04 23:14:48,ethizzelle,NewYorkStateAG,0,0,0,"Our cause is just. We will hold the lines. For all of us. #Solidarity #BlackLivesMatter https:// twitter.com/NewYorkStateAG /status/1268677052401700864 …",,,#Solidarity #BlackLivesMatter,1268682645900165121,https://twitter.com/ethizzelle/status/1268682645900165121
2020-06-04 23:14:48,TurquoiseSound,TurquoiseSound,0,0,0,"AUDIO ONLY: https:// taoteturquoise.bandcamp.com/track/i-cant-b reathe … #BlackLivesMatter",,,#BlackLivesMatter,1268682644683984901,https://twitter.com/TurquoiseSound/status/1268682644683984901
2020-06-04 23:14:47,TEQUILLA_noTILA,Penny_Proud_OK,0,2,1,"Our ancestors suffered too much for us to sit quietly !! #BlackLivesMatter https:// twitter.com/penny_proud_ok /status/1268681632925581313 …",,,#BlackLivesMatter,1268682643761225730,https://twitter.com/TEQUILLA_noTILA/status/1268682643761225730
2020-06-04 23:14:47,fnytv,realDonaldTrump,0,0,0,"This is who the President of the United States thinks of when he sees people supporting #BlackLivesMatter . https:// twitter.com/realdonaldtrum p/status/1268166288993632256 …",,,#BlackLivesMatter,1268682642465095681,https://twitter.com/fnytv/status/1268682642465095681
2020-06-04 23:14:47,Ellie_Cutler,,0,0,0,"I guess my question to the all lives matter people, is that if you aren’t a racist, is it so hard to be in support of #blacklivesmatter ? What do you have to lose by supporting a positive movement of another group of human beings?",,,#blacklivesmatter,1268682641278107650,https://twitter.com/Ellie_Cutler/status/1268682641278107650
2020-06-04 23:14:46,SluttySlutSlut1,,0,0,0,"YESSSS!!! #BlackLivesMatter Is Suing Trump And The Federal Government Over Force Used Against Protesters Outside The White House https://www. buzzfeednews.com/article/zoetil lman/black-lives-matter-lawsuit-police-tear-gas-white-house …",,,#BlackLivesMatter,1268682639084584960,https://twitter.com/SluttySlutSlut1/status/1268682639084584960
2020-06-04 23:14:46,sxndravides,,0,0,2,"This made me so sad, black lives matter is NOT a trend. Talking about injustices affecting black people is NOT a trend. please continue to show support for those that are hurting right now. #BlackLivesMatter pic.twitter.com/Kbxni5gJNs",,,#BlackLivesMatter,1268682638551691264,https://twitter.com/sxndravides/status/1268682638551691264
2020-06-04 23:14:46,mbparry,,0,0,2,"@cnnbrk @CNN Today’s thousands strong, peaceful protest in Nashville was organized by 15 year-olds with help from #blacklivesmatter . Shout out to them Thank you, Nashville teens and #blacklivesmatter !",,@cnnbrk @CNN,#blacklivesmatter #blacklivesmatter,1268682637218058240,https://twitter.com/mbparry/status/1268682637218058240
2020-06-04 23:14:46,EmGeeIndy,QuickTake,0,0,0,"I think this is a peek at the Indiana my mother was worried about when I told her I was moving to this state 15 years ago. Her fears weren’t unfounded. Here we are. #blacklivesmatter https:// twitter.com/quicktake/stat us/1268460002756497409 …",,,#blacklivesmatter,1268682636991528962,https://twitter.com/EmGeeIndy/status/1268682636991528962
2020-06-04 23:14:45,eternaIIytyun,,0,0,0,"Pls take a moment to look into these carrds!!! #BlackLivesMatter #JunkTerrorBill • http:// blacklivesmatters.carrd.co • http:// junkterrorbill.carrd.co",,,#BlackLivesMatter #JunkTerrorBill,1268682635317923840,https://twitter.com/eternaIIytyun/status/1268682635317923840
2020-06-04 23:14:45,aquanasium,,0,0,0,"6/3/2020 George Floyd Memorial, Cadman Plaza Brooklyn. #georgefloyd #blacklivesmatter @Brooklyn, New York https://www. instagram.com/p/CBB_7VvDk4U/ ?igshid=1gfnlm52iy3c4 …",,@Brooklyn,#georgefloyd #blacklivesmatter,1268682635246735360,https://twitter.com/aquanasium/status/1268682635246735360
2020-06-04 23:14:45,WorldOfBLM,,0,0,0,"Tupac speaking on being black in the United States. #blm #blacklivesmatter #blackexcellence #feminist #melanin #blackhistory #blackgirlmagic #lgbt #racism #feminism #lgbtq #trump #blackhistorymonth #blackmen #blackqueen #memes #blacklove #blackwomen #love #black #loveislove pic.twitter.com/YSZ4Rs7wAA",,,#blm #blacklivesmatter #blackexcellence #feminist #melanin #blackhistory #blackgirlmagic #lgbt #racism #feminism #lgbtq #trump #blackhistorymonth #blackmen #blackqueen #memes #blacklove #blackwomen #love #black #loveislove,1268682634923835395,https://twitter.com/WorldOfBLM/status/1268682634923835395
2020-06-04 23:14:44,ItsSlipz,,0,0,0,"I stand with the #BlackLivesMatter movement What is happening in this world and what continues to happen is disgusting, horrendous and shocking Change needs to happen Sign petitions, donate, protest",,,#BlackLivesMatter,1268682631320866819,https://twitter.com/ItsSlipz/status/1268682631320866819
2020-06-04 23:14:44,SuperOtterBoy,BelleInterne,0,0,0,"The people of America deserve better than these villains! The entire country has become overruled by psycopathic bullies! #blacklifematters #BlackLivesMatter https:// twitter.com/BelleInterne/s tatus/1268353666001453056 …",,,#blacklifematters #BlackLivesMatter,1268682630104584192,https://twitter.com/SuperOtterBoy/status/1268682630104584192
2020-06-04 23:14:44,hurleychick9,,0,0,1,"Powerful baby girl. #blacklivesmatter pic.twitter.com/AI6h4CF2Wa",,,#blacklivesmatter,1268682628405825537,https://twitter.com/hurleychick9/status/1268682628405825537
2020-06-04 23:14:43,DebMyA,DebMyA,0,0,0,"If this is so with the sixth person on the list, what can you expect from the other names? So #BlackLivesMatter ... pic.twitter.com/IdqD6oMvEe",,,#BlackLivesMatter,1268682624870109185,https://twitter.com/DebMyA/status/1268682624870109185
2020-06-04 23:14:43,Michaeljross619,The_RibeiroLuk,0,0,0,"We’re on the same side, man. I just disagreed with you this and gave the reasons why. A disagreement is not an attack. I’ve been dedicated to anti-racism and personally trying to improve my own shortcomings my entire adult life. I will never NOT say #blacklivesmatter",,,#blacklivesmatter,1268682623238406152,https://twitter.com/Michaeljross619/status/1268682623238406152
2020-06-04 23:14:42,zimirene,,0,0,0,"I know it’s not the same but Hong Kong needs help too #GeorgeFloyd #BlackLivesMatter #HongKong pic.twitter.com/n9gwR0CYTm",,,#GeorgeFloyd #BlackLivesMatter #HongKong,1268682622261014529,https://twitter.com/zimirene/status/1268682622261014529
2020-06-04 23:14:42,TMooreSports,,0,0,1,"From T.Moore: Yeah, #DrewBrees blew it during #GeorgeFloyd mourning. But for #Saints and #WhoDatNation , it doesn’t matter. Teammates hated #Michaeljordan too. See what happened? ⁦ @ForbesSports ⁩ #blacklivesmatter https://www. forbes.com/sites/terencem oore/2020/06/04/drew-brees-controversy-involving-george-floyd-and-national-anthem-wont-hinder-super-bowl-chances-for-the-new-orleans-saints/#b4152c958f4f …",,@ForbesSports,#DrewBrees #GeorgeFloyd #Saints #WhoDatNation #Michaeljordan #blacklivesmatter #b4152c958f4f,1268682621690806274,https://twitter.com/TMooreSports/status/1268682621690806274
2020-06-04 23:14:42,LewisJFC,,0,0,0,"I donated to this. Everyone, do the thing too if you can. #BlackLivesMatter https:// secure.actblue.com/donate/bail_fu nds_george_floyd …",,,#BlackLivesMatter,1268682621636182016,https://twitter.com/LewisJFC/status/1268682621636182016
2020-06-04 23:14:42,jbrianrogers,joelebert29,0,0,0,"Wow!! #blacklivesmattertn #BlackLivesMatter the youth showed up! https:// twitter.com/joelebert29/st atus/1268681615020081154 …",,,#blacklivesmattertn #BlackLivesMatter,1268682621036507136,https://twitter.com/jbrianrogers/status/1268682621036507136
2020-06-04 23:14:42,OliQuinnn,,1,0,1,"WE RAISED $100! It’s crazy to think my small platform could have an impact. I love this online community who are helping to fight all the injustices faced by so many amazing people every day. #BlackLivesMatter",,,#BlackLivesMatter,1268682619232927745,https://twitter.com/OliQuinnn/status/1268682619232927745
2020-06-04 23:14:42,VictorLicata1,,0,0,2,"Alligator said #BlackLivesMatter . pic.twitter.com/1GcMuzsJnv",,,#BlackLivesMatter,1268682619228569600,https://twitter.com/VictorLicata1/status/1268682619228569600
