date,username,to,replies,retweets,favorites,text,geo,mentions,hashtags,id,permalink
2020-06-04 23:16:16,tyalcott,,0,0,1,"DO NOT FORGET ABOUT REGIS KORCHINSKI-PAQUET. DO NOT FORGET ABOUT REGIS KORCHINSKI-PAQUET. DO NOT FORGET ABOUT REGIS KORCHINSKI-PAQUET. DO NOT FORGET ABOUT REGIS KORCHINSKI-PAQUET. DO NOT FORGET ABOUT REGIS KORCHINSKI-PAQUET. #JusticeForRegis #BlackLivesMatter",,,#JusticeForRegis #BlackLivesMatter,1268683014034374657,https://twitter.com/tyalcott/status/1268683014034374657
2020-06-04 23:16:15,10madeit,,0,0,0,"The police are the most dangerous gang in America. #blacklivesmatter A photo I took during the protest in downtown Cleveland. @ClevelandPolice threw smoke bombs and tear gas into crowds including children, like this young boy here. (I’ve checked in with him and he is OK now) pic.twitter.com/6KavEn7KgU",,@ClevelandPolice,#blacklivesmatter,1268683012482437120,https://twitter.com/10madeit/status/1268683012482437120
2020-06-04 23:16:14,MeredithJamie,,0,0,0,"Peaceful protest at Gracie Mansion, Today June 4. Just the sounds of birds chirping and the police state surveilling us from above. #Repeal50a #blacklivesmatter #BlackMamasMatter pic.twitter.com/twZ6MMo7Zj",,,#Repeal50a #blacklivesmatter #BlackMamasMatter,1268683008195903489,https://twitter.com/MeredithJamie/status/1268683008195903489
2020-06-04 23:16:14,MonishCorona,,0,0,0,"I’ve been struggling to make anything right now because there are just bigger things at hand at the moment that need to be focused on. Donate to organizations if you can, protest if possible, and continue to support to those who need to be heard right now. #BlackLivesMatter",,,#BlackLivesMatter,1268683005519773697,https://twitter.com/MonishCorona/status/1268683005519773697
2020-06-04 23:16:13,LibraryofLexie,,0,0,2,"My little brother is out protesting in D.C. he’s been out there since 3pm. I unfortunately am back working full time so I have been unable to protest. He’s definitely making his big sister proud. I am a proud sister of a black man. #blacklivesmatter #blackandproud",,,#blacklivesmatter #blackandproud,1268683004404211714,https://twitter.com/LibraryofLexie/status/1268683004404211714
2020-06-04 23:16:13,craZasfack,TheDamaniFelder,0,0,0,"Whites (or even any other race) posting anything pro or for blm with a passion makes me think of the nerdy kid that is trying too hard to fit in with the cool crowd. #blacklivesmatter #conformity",,,#blacklivesmatter #conformity,1268683003741511680,https://twitter.com/craZasfack/status/1268683003741511680
2020-06-04 23:16:13,AuthorVillage,,0,0,0,"If you missed the In Conversation about racism with @JasonReynolds83 and @KielyBrendan , the replay will remain available through Sunday 6/7. ALL of the authors’ proceeds will be donated to various groups and organizations. #kidlit #BlackLivesMatter https://www. crowdcast.io/e/5s5zhkoa",,@JasonReynolds83 @KielyBrendan,#kidlit #BlackLivesMatter,1268683003246542848,https://twitter.com/AuthorVillage/status/1268683003246542848
2020-06-04 23:16:13,edie401,,0,0,0,"Posted withregram • tobehonestnl We are in this together, period. No exceptions. (It’s okay to share/repost with credits/tag!) #blacklivesmatter #westandunited #womenempowerment #womenempoweringwomen #youarenotalone … https://www. instagram.com/p/CBCAGEBn9Wn/ ?igshid=34wsyhsn2qxa …",,,#blacklivesmatter #westandunited #womenempowerment #womenempoweringwomen #youarenotalone,1268683003078873088,https://twitter.com/edie401/status/1268683003078873088
2020-06-04 23:16:13,Andrewfabernel,BenFordhamLive,0,0,0,"So... sending my child to school with over 1,000 other kids for 7 hours straight is deemed medically acceptable but turning up to support the #blacklivesmatter movement in an outdoor space for an hour is ‘certifiably insane’?!?!",,,#blacklivesmatter,1268683000918577153,https://twitter.com/Andrewfabernel/status/1268683000918577153
2020-06-04 23:16:12,RobCastaneda97,josecanyousee,0,0,0,"This had me on the verge of tears. In my years of studying Poli Sci, this plea moved me more than ever. Do realize the situation and pressure the people who represent you local, state & federal. We must put an end to this! #BlackLivesMatter https:// twitter.com/josecanyousee/ status/1268640245706186752 …",,,#BlackLivesMatter,1268682997793820674,https://twitter.com/RobCastaneda97/status/1268682997793820674
2020-06-04 23:16:12,VikkySenpai,Mengo329,0,0,0,"yikes, man fakes a tweet then gets a real tweet of his dug up, these the clout chasers that don't help the #blacklivesmatter movement, but hurt it. INNOCENTS KILLED AREN'T YOUR WAY TO FAME. https:// twitter.com/Mengo329/statu s/1268681493867528193 …",,,#blacklivesmatter,1268682997013897227,https://twitter.com/VikkySenpai/status/1268682997013897227
2020-06-04 23:16:10,JimmyRussell77,PromNig74191126,0,0,2,"#blacklivesmatter #gobaldforblm Powerful https:// twitter.com/promnig7419112 6/status/1268648927991148546 …",,,#blacklivesmatter #gobaldforblm,1268682992249122816,https://twitter.com/JimmyRussell77/status/1268682992249122816
2020-06-04 23:16:10,EthanNi75591102,austintexasgov,0,0,0,"Austin Police doesn’t care about black men. #blacklivesmatter",,,#blacklivesmatter,1268682991599071233,https://twitter.com/EthanNi75591102/status/1268682991599071233
2020-06-04 23:16:10,CakeCafeAtlanta,,0,0,0,"I appreciated this email I received... #blacklivesmatter #support #georgefloyd #peace #blackpeople #usa #ardrasinett #activist #cookingcoutureatlanta @Atlanta, Georgia https://www. instagram.com/p/CBCAFfQBGJF/ ?igshid=jk8ff2y2p4bb …",,@Atlanta,#blacklivesmatter #support #georgefloyd #peace #blackpeople #usa #ardrasinett #activist #cookingcoutureatlanta,1268682991485812738,https://twitter.com/CakeCafeAtlanta/status/1268682991485812738
2020-06-04 23:16:10,mohdashoor,,0,0,0,"We Cannot Stay Silent About George Floyd | Patriot Act https:// youtu.be/i_FE78X-qdY Well said @hasanminhaj #BlackLivesMatter",,@hasanminhaj,#BlackLivesMatter,1268682991397675008,https://twitter.com/mohdashoor/status/1268682991397675008
2020-06-04 23:16:10,BlkGirlsSoapbox,,0,0,0,"Gianna Floyd "" Yes! Your Daddy Did Change The World"" #BlackLivesMatter https:// youtu.be/BmNb3Mf7Crk via @YouTube .",,@YouTube,#BlackLivesMatter,1268682990462345221,https://twitter.com/BlkGirlsSoapbox/status/1268682990462345221
2020-06-04 23:16:10,LacyLeighLove,,0,0,0,"Does anyone know if these were National Guard stationed around City Hall at the @BLMHOU march on 6/2? They were stationed in full gear on all the surrounding buildings. It was a very vulnerable feeling. #BLMHOU #BlackLivesMatter #HoustonProtest pic.twitter.com/zngYgse1TS",,@BLMHOU,#BLMHOU #BlackLivesMatter #HoustonProtest,1268682989908766720,https://twitter.com/LacyLeighLove/status/1268682989908766720
2020-06-04 23:16:10,NPOPunk,,0,0,0,"Just a side note... my fellow white people... It’s still a Fuck you to you if you’re yelling #blacklivesmatter but not checking how you speak about/with other POC.",,,#blacklivesmatter,1268682988667244546,https://twitter.com/NPOPunk/status/1268682988667244546
2020-06-04 23:16:09,educated_educ8r,teachergoals,0,0,0,"Love this. #BlackLivesMatter https:// twitter.com/teachergoals/s tatus/1268680165267255297 …",,,#BlackLivesMatter,1268682987396313089,https://twitter.com/educated_educ8r/status/1268682987396313089
2020-06-04 23:16:09,powerofselflove,,0,0,0,"Black. Lives. Matter. #blacklivesmatter @Black Lives Matter https://www. instagram.com/p/CBCAFsdn9l6/ ?igshid=1ind04kotkply …",,@Black,#blacklivesmatter,1268682987169878023,https://twitter.com/powerofselflove/status/1268682987169878023
2020-06-04 23:16:09,TurquoiseSound,TurquoiseSound,0,0,0,"AUDIO ONLY: https:// taoteturquoise.bandcamp.com/track/i-cant-b reathe … #BlackLivesMatter",,,#BlackLivesMatter,1268682986716889088,https://twitter.com/TurquoiseSound/status/1268682986716889088
2020-06-04 23:16:09,NewBrunswickTAP,,0,0,0,"Gov. Murphy, Countless Others Observe Moment of Silence for George Floyd @NAACP #GeorgeFloyd @NAACP @nbabnaacp #JusticeForGeorgeFloyd #BlackLivesMatter #BLM #iCantBreathe @GovMurphy #WeAreDoneDying https://www. tapinto.net/towns/new-brun swick/articles/gov-murphy-countless-others-observe-moment-of-silence-for-george-floyd …",,@NAACP @NAACP @nbabnaacp @GovMurphy,#GeorgeFloyd #JusticeForGeorgeFloyd #BlackLivesMatter #BLM #iCantBreathe #WeAreDoneDying,1268682986653917185,https://twitter.com/NewBrunswickTAP/status/1268682986653917185
2020-06-04 23:16:09,softfiresun,,0,0,0,"It's time for Edmonton to divest from its bloated police budget and invest in communities. Stand with us by joining our letter campaign #blacklivesmatter #yeg http:// act.newmode.social/646985669t",,,#blacklivesmatter #yeg,1268682984971886593,https://twitter.com/softfiresun/status/1268682984971886593
2020-06-04 23:16:09,sharakarasic,,0,0,0,"Your Donations and Hashtags Aren’t Enough! We Want to Hear Your Plan. https://www. linkedin.com/pulse/your-don ations-hashtags-arent-enough-we-want-hear-murphy-english/ … by @RalphetteE #blacklivesmatter",,@RalphetteE,#blacklivesmatter,1268682984799911937,https://twitter.com/sharakarasic/status/1268682984799911937
2020-06-04 23:16:09,KateCantrell,Marissa_Jae,0,0,0,"Washington, DC #dcprotest #BlackLivesMatter https:// twitter.com/Marissa_Jae/st atus/1268682135109603329 …",,,#dcprotest #BlackLivesMatter,1268682983965409280,https://twitter.com/KateCantrell/status/1268682983965409280
2020-06-04 23:16:08,ErrantNerd,CorrieroAnthony,0,0,0,"I admit I haven't rewatched that episode since it aired, but mainly because I don't need my blood pressure issues to get aggravated by a lot of what happens. Heck, what's been happening hasn't helped. #BlackLivesMatter , always.",,,#BlackLivesMatter,1268682982048464897,https://twitter.com/ErrantNerd/status/1268682982048464897
2020-06-04 23:16:08,netflixandbeard,,0,0,0,"I’m so fucking happy to be drawing again. For anyone looking to commission me this month, the proceeds will go to any #BlackLivesMatter fund of your choice. pic.twitter.com/FZMhqsxZZZ",,,#BlackLivesMatter,1268682981511589893,https://twitter.com/netflixandbeard/status/1268682981511589893
2020-06-04 23:16:08,evil_scott,,0,0,0,"Can someone please explain to @dusm1811 what selfish means since he obviously have no clue. #BlackLivesMatter pic.twitter.com/sflZeF2Z5A",,@dusm1811,#BlackLivesMatter,1268682980119240705,https://twitter.com/evil_scott/status/1268682980119240705
2020-06-04 23:16:07,BeemerJules,,0,0,0,"This is how I want to see my community represented in the media. #BlackLivesMatter #LakeStevens #snohomishcounty pic.twitter.com/xVWuhIiO3S",,,#BlackLivesMatter #LakeStevens #snohomishcounty,1268682979590590466,https://twitter.com/BeemerJules/status/1268682979590590466
2020-06-04 23:16:07,rebowers,,0,0,0,"#Eyeballs in #QueenAnne #Seattle with a great #BlackLivesMatter message. pic.twitter.com/MFqDaljqtk",,,#Eyeballs #QueenAnne #Seattle #BlackLivesMatter,1268682978026090498,https://twitter.com/rebowers/status/1268682978026090498
2020-06-04 23:16:06,Aq1l_Ghan1,,0,0,0,"Someone needs to make an app that livestreams a direct feed from your phone to an online database that can be accesed by lawyers. The app should be voice activated by a trigger phase so the cops don't know u filming. #Blacklivesmatter",,,#Blacklivesmatter,1268682972129120257,https://twitter.com/Aq1l_Ghan1/status/1268682972129120257
2020-06-04 23:16:05,Quotemeorelse,realDonaldTrump,0,0,0,"Arsonists, looters, criminals, and anarchists....are the 1% of this movement. #BlackLivesMatter #GetYourKneeOffOurNecks https:// twitter.com/realDonaldTrum p/status/1268678440225583105 …",,,#BlackLivesMatter #GetYourKneeOffOurNecks,1268682970145013761,https://twitter.com/Quotemeorelse/status/1268682970145013761
2020-06-04 23:16:05,GriffKohout,AOC,0,0,1,"#justice for Michael Stewart ! #black street #artist killed by NYPD in #NYC subways for allegedly doing #graffiti in 1983 #sayhisname #MICHAELSTEWART ! #blacklivesmatter #venicebeach #NelsonMandela #Unity #streetart #nypd #PoliceViolence #PoliceBrutality #usa #artists #basquiat pic.twitter.com/knFJLoMtJP",,,#justice #black #artist #NYC #graffiti #sayhisname #MICHAELSTEWART #blacklivesmatter #venicebeach #NelsonMandela #Unity #streetart #nypd #PoliceViolence #PoliceBrutality #usa #artists #basquiat,1268682969931083776,https://twitter.com/GriffKohout/status/1268682969931083776
2020-06-04 23:16:04,KristinaRex,,0,2,3,"HAPPENING NOW: Outside Boston Police Jamaica Plain Neighborhood Station #BlackLivesMatter protest #WBZ pic.twitter.com/snxIVAkYgl",,,#BlackLivesMatter #WBZ,1268682966563160065,https://twitter.com/KristinaRex/status/1268682966563160065
2020-06-04 23:16:04,shanecelis,AndrewLiptak,0,1,1,"Loved Andrew’s newsletter today: Read Black Authors. It got me thinking, who are the black #gamedev s and what are their games? Well, here’s a small sampling. Link to any you know or find. https://www. inverse.com/gaming/video-g ames-by-black-developers … #BlackLivesMatter https:// twitter.com/andrewliptak/s tatus/1268634229581193217 …",,,#gamedev #BlackLivesMatter,1268682965724336130,https://twitter.com/shanecelis/status/1268682965724336130
2020-06-04 23:16:04,Deadwards_,,0,0,0,"White women: the anger and power you feel while listening to Goodbye Earl or Before He Cheats... direct that shit at cops, that energy is STRONG #BlackLivesMatter",,,#BlackLivesMatter,1268682965694865410,https://twitter.com/Deadwards_/status/1268682965694865410
2020-06-04 23:16:04,Rokkenwolf,,0,0,1,"Some wise words from Meowth from back in 1999 that still resonate today. Be safe out there and stand up for what's right #pokemon #meowth #anime #BlackLivesMatter #blacklifematters #blm #blacklivesmattercanada pic.twitter.com/mLEJ9xudmn",,,#pokemon #meowth #anime #BlackLivesMatter #blacklifematters #blm #blacklivesmattercanada,1268682965288017921,https://twitter.com/Rokkenwolf/status/1268682965288017921
2020-06-04 23:16:04,CaitisCandles,villainandeve,0,1,9,"#BlackLivesMatter and candles are awesome. Why not support both? https:// twitter.com/villainandeve/ status/1268391737308962816 …",,,#BlackLivesMatter,1268682964398944256,https://twitter.com/CaitisCandles/status/1268682964398944256
2020-06-04 23:16:04,jpierni,,0,0,0,"WHERE'S THE HUMANITY IN YOU! If that helicopter had accidentally crashed would of have you still walked to the church? #BunkerBoyTrump you're a WEAK MAN #OneVoice1 #TrumpDictatorship #Trump #TrumpHasNoPlan #BlackLivesMatter #riots2020 https:// twitter.com/realDonaldTrum p/status/1268678440225583105 … pic.twitter.com/yjqiytJwTG",,,#BunkerBoyTrump #OneVoice1 #TrumpDictatorship #Trump #TrumpHasNoPlan #BlackLivesMatter #riots2020,1268682963996364800,https://twitter.com/jpierni/status/1268682963996364800
2020-06-04 23:16:04,LoveForLouisXX,,0,0,0,"It takes nothing to not say the n word. It takes ignorance and disrespect to say it, though. #BlackLivesMatter",,,#BlackLivesMatter,1268682963383775232,https://twitter.com/LoveForLouisXX/status/1268682963383775232
2020-06-04 23:16:03,ConduitCross,,0,0,0,"Dear white people that say ""if you don't like it here leave"" In the words of @KillerMike FUCK WHAT YOU ORDERED, THIS IS WHAT YOU'RE STUCK WITH! #BlackLivesMatter #SayHerName #SayHisName #SayTheirName pic.twitter.com/PvnCrQ51sy",,@KillerMike,#BlackLivesMatter #SayHerName #SayHisName #SayTheirName,1268682960401846274,https://twitter.com/ConduitCross/status/1268682960401846274
2020-06-04 23:16:03,kyiiaaa,,1,2,2,"LINK IN BIO!! If you aren’t able to go out and protest or able to donate signing petitions helps! There’s no excuse we need change and our voices need heard #blacklivesmatter #blm pic.twitter.com/6XFQkV1JkN",,,#blacklivesmatter #blm,1268682959625879552,https://twitter.com/kyiiaaa/status/1268682959625879552
2020-06-04 23:16:03,JUNP_N,,0,0,0,"Allyship Right Now: #BlackLivesMatter https:// blog.twitter.com/en_us/topics/c ompany/2020/allyship-right-now-black-lives-matter.html …",,,#BlackLivesMatter,1268682959478861824,https://twitter.com/JUNP_N/status/1268682959478861824
2020-06-04 23:16:02,rarityfirefly,TheRealElvira,0,0,0,"All lives don’t matter until #BlackLivesMatter",,,#BlackLivesMatter,1268682957511970816,https://twitter.com/rarityfirefly/status/1268682957511970816
2020-06-04 23:16:01,5minutesformom,,0,0,0,"32 Pictures That Show What White Privilege Looks Like @BuzzFeed https:// bzfd.it/3cDgNCi #BlackLivesMatter pic.twitter.com/oErRRnL0bY",,@BuzzFeed,#BlackLivesMatter,1268682953095331840,https://twitter.com/5minutesformom/status/1268682953095331840
2020-06-04 23:16:00,angelwinged,,0,0,0,"It starts now #kwamealexander #blacklivesmatter",,,#kwamealexander #blacklivesmatter,1268682950230540294,https://twitter.com/angelwinged/status/1268682950230540294
2020-06-04 23:16:00,radbecca_,,0,0,0,"I just split a donation to 70+ bail funds and racial justice orgs at http:// CommunityBailFunds.com . You can too. Please donate today. #BlackLivesMatter https:// secure.actblue.com/donate/bail_fu nds_george_floyd …",,,#BlackLivesMatter,1268682949072949249,https://twitter.com/radbecca_/status/1268682949072949249
2020-06-04 23:16:00,LoveForLouisXX,,1,0,0,"I'm low-key pissed after watching ""do all white people think the same?"" So this is a thread about why I, as a white person, have never and will never say the n word. #BlackLivesMatter",,,#BlackLivesMatter,1268682946484948993,https://twitter.com/LoveForLouisXX/status/1268682946484948993
2020-06-04 23:16:00,protestsafe1,,0,0,1,"People are fighting for their freedom while getting bombarded with crowd control measures. Follow us for tips on how to stay safe and how to heal yourself & others during these protests. Stay safe out there and take care of each other #BlackLivesMatter #protest2020 pic.twitter.com/jOvoxdzeW8",,,#BlackLivesMatter #protest2020,1268682946170351617,https://twitter.com/protestsafe1/status/1268682946170351617
2020-06-04 23:15:59,ionel_prodan,,0,0,0,"Beyoncé Speaks Out on Justice After George Floyd Murder #GeorgeFloyd #BlackLivesMatter http://www. haystack.tv/v/beyonc-speak s-justice-george-floyd-murder …",,,#GeorgeFloyd #BlackLivesMatter,1268682945973252097,https://twitter.com/ionel_prodan/status/1268682945973252097
2020-06-04 23:15:59,MatthewNGeist,,0,0,12,"I want to use my platform to promote this link that has all different resources to donate/educate on the matter. #BlackLivesMatter https:// docs.google.com/document/d/1sb mCgvPcjhZRn-2WFpYjSBwj7qVOgpdEHJM-ejyLb-s/preview?pru=AAABcqTNCD4*XyGgTWkFLeu3HcVxMDi4yg …",,,#BlackLivesMatter,1268682945147043840,https://twitter.com/MatthewNGeist/status/1268682945147043840
2020-06-04 23:15:59,Veggie_Voyager,,0,0,0,"Watched this video from @PlantBasedNews news. They make some great points https:// youtu.be/XPF35H9RLNE #vegan #veganism #diary #blacklivesmatter #BlackLivesMattterUK pic.twitter.com/QuJYi2wfGT",,@PlantBasedNews,#vegan #veganism #diary #blacklivesmatter #BlackLivesMattterUK,1268682942626385921,https://twitter.com/Veggie_Voyager/status/1268682942626385921
2020-06-04 23:15:59,moe_down,cnnbrk,0,0,0,"as if this was question? happy the right answer was given. #blacklivesmatter #JusticeforAhmaudArbery https:// twitter.com/cnnbrk/status/ 1268650861070344193 …",,,#blacklivesmatter #JusticeforAhmaudArbery,1268682941938438146,https://twitter.com/moe_down/status/1268682941938438146
2020-06-04 23:15:58,TurquoiseSound,AWAL,1,0,0,"VIDEO: https:// youtu.be/op6lPn-akNE #BlackLivesMatter",,,#BlackLivesMatter,1268682941426798592,https://twitter.com/TurquoiseSound/status/1268682941426798592
2020-06-04 23:15:58,tigerlord227,bubbahyunjin,0,0,1,"People I know who wouldn't break the chain @Ayyitskel @elitehElM @fairiecupid #blacklivesmatter",,@Ayyitskel @elitehElM @fairiecupid,#blacklivesmatter,1268682941238063104,https://twitter.com/tigerlord227/status/1268682941238063104
2020-06-04 23:15:58,Mimi_Marandu,YeshaCallahan,0,0,0,"They really make up everything to harass little children. #BlackLivesMatter https:// twitter.com/yeshacallahan/ status/1268577680183590919 …",,,#BlackLivesMatter,1268682939375779843,https://twitter.com/Mimi_Marandu/status/1268682939375779843
2020-06-04 23:15:57,helayne_weiss,,0,0,0,"This afternoon in #Hackensack was very powerful #blacklivesmatter #hackensackprotest #nj pic.twitter.com/q4w7gO76GS",,,#Hackensack #blacklivesmatter #hackensackprotest #nj,1268682936003551233,https://twitter.com/helayne_weiss/status/1268682936003551233
2020-06-04 23:15:57,ThisIsMarlena,,0,0,1,"To stand in solidarity with #blacklivesmatter I created this graphic that anyone is welcome to use to show their solidarity too. There are two versions available. It's in the Dakota language and translates to Black Lives Matter. #NativeTwitter pic.twitter.com/L9FnFkhHHy",,,#blacklivesmatter #NativeTwitter,1268682934887821313,https://twitter.com/ThisIsMarlena/status/1268682934887821313
2020-06-04 23:15:56,MrTazzman32,jimahsjournals,0,0,0,"A quick scan of Catrina's limited timeline is a revealing insight into the mind of someone who feels her right to be a racist bitch is coming under serious challenge so she comes out flailing to defend her right to be a racist. Keep on fighting the bigots. #blacklivesmatter",,,#blacklivesmatter,1268682932631343105,https://twitter.com/MrTazzman32/status/1268682932631343105
2020-06-04 23:15:56,Tufukins,Tufukins,0,0,0,"My inner anger wants so badly to call you and so many others absolute troglodytes, but I don't want to assume that you don't have good intentions. I want to believe you have good intentions. And I want you to understand that so does #BlackLivesMatter We need change.",,,#BlackLivesMatter,1268682932589400066,https://twitter.com/Tufukins/status/1268682932589400066
2020-06-04 23:15:56,sjcowan,,0,0,0,"Paul Mpagi Sepuya is fundraising in exchange for a print! As a response to #BlackLivesMatter protests, Sepuya is fundraising for organisations supporting civil rights, queer rights, housing advocacy, voting rights and ending mass incarceration. https:// shop.vielmetter.com/products/paul- mpagi-sepuya-print …",,,#BlackLivesMatter,1268682931876139014,https://twitter.com/sjcowan/status/1268682931876139014
2020-06-04 23:15:56,JacobKolbVA,,0,3,3,"A group calling themselves ""the Boone County Militia"" are arming themselves to meet the PEACEFUL protestors going to Harrison Arkansas. They claim to be ""preventing looters"". I can't make this garbage up. Please be super careful out there everyone. #BlackLivesMatter",,,#BlackLivesMatter,1268682929649135617,https://twitter.com/JacobKolbVA/status/1268682929649135617
2020-06-04 23:15:56,njmhji,righttt8,0,0,1,"and that’s on #blacklivesmatter https:// twitter.com/righttt8/statu s/1268680947291041792 …",,,#blacklivesmatter,1268682929556897793,https://twitter.com/njmhji/status/1268682929556897793
2020-06-04 23:15:55,Spruce_GA,,0,0,1,"If you support the police unfollow me right now. If you support trump unfollow we. We can't be friends. They stand for a corrupt system that has damaged the lives of minorities of all types. We must use our 1st amendment rights and build a fair society. #BlackLivesMatter",,,#BlackLivesMatter,1268682926402781185,https://twitter.com/Spruce_GA/status/1268682926402781185
2020-06-04 23:15:54,AvBerrebi,,0,0,0,"Each day the NFL becomes less and less relevant They send healthy men into the arena to get brain damage Just like gladiators in the Roman Colosseum #DrewBrees said what he believed but now worries about his job #DrewBreesISOVER @NFL #BlackLivesMatter https://www. cbssports.com/nfl/news/drew- brees-faces-backlash-from-saints-teammates-and-beyond-for-comments-about-kneeling-during-the-anthem/amp/ …",,@NFL,#DrewBrees #DrewBreesISOVER #BlackLivesMatter,1268682924750036992,https://twitter.com/AvBerrebi/status/1268682924750036992
2020-06-04 23:15:54,The_J_Dean,sethsrott,1,0,0,"Bears out protesting pigs too. #BlackLivesMatter #BlackBearsMatter #DefundThePolice https:// twitter.com/sethsrott/stat us/1268680772141137920 …",,,#BlackLivesMatter #BlackBearsMatter #DefundThePolice,1268682923760406534,https://twitter.com/The_J_Dean/status/1268682923760406534
2020-06-04 23:15:54,JeffcoESPA,,0,0,0,". @JeffcoSchoolsCo negotiated with JESPA and we have reached a tentative agreement to work on increasing educators of color by creating a paraprofessional to teacher pipeline in our CBA. #BlackLivesMatter #BlackteachersMatter",,@JeffcoSchoolsCo,#BlackLivesMatter #BlackteachersMatter,1268682923298832384,https://twitter.com/JeffcoESPA/status/1268682923298832384
2020-06-04 23:15:54,natepavlov,,0,0,0,"Between these 2 photos is 70 years difference ; Civil war ended in 1865 - But #Racism still exists! It hurts me so much tjat even in #2020 black people need to #fight for their rights just becuase of their colour #blacklifematters #BlackLivesMatter pic.twitter.com/E8mNr4yJjK",,,#Racism #2020 #fight #blacklifematters #BlackLivesMatter,1268682922313252864,https://twitter.com/natepavlov/status/1268682922313252864
2020-06-04 23:15:53,iamtrendytoo,blogTO,0,0,0,"Next we have #antifa agitators coming to #Toronto and planting bricks to instigate a riot and blame #BlackLivesMatter for it, is that what you want? pic.twitter.com/kgLCgqlN0x",,,#antifa #Toronto #BlackLivesMatter,1268682919796789249,https://twitter.com/iamtrendytoo/status/1268682919796789249
2020-06-04 23:15:52,bluegreencosmos,,0,0,1,"https:// youtu.be/FDrmkhJG89M Black storeowner rips looters for destroying her Bronx shop #blacklivesmatter #AllLivesMattter",,,#blacklivesmatter #AllLivesMattter,1268682914973257728,https://twitter.com/bluegreencosmos/status/1268682914973257728
