date,username,to,replies,retweets,favorites,text,geo,mentions,hashtags,id,permalink
2020-06-04 23:13:25,DrRana_Centrist,globeandmail,0,0,1,"How can you expect justice when oppressor, lawyer and judge is the same system? @Justice4Soli #indiginouslivesmatter #chantal #BlackLivesMatter #racism #GeorgeFloyd https:// twitter.com/globeandmail/s tatus/1268680712430866433 …",,@Justice4Soli,#indiginouslivesmatter #chantal #BlackLivesMatter #racism #GeorgeFloyd,1268682297521422339,https://twitter.com/DrRana_Centrist/status/1268682297521422339
2020-06-04 23:13:25,merca_bae,,0,0,0,"All profits made on this track will be donated to different organizations that support the black community and the #blacklivesmatter movement. Plus the profits made on my whole catalog during this weekend will be added to the cause. https:// mercabae.bandcamp.com/releases",,,#blacklivesmatter,1268682296195977219,https://twitter.com/merca_bae/status/1268682296195977219
2020-06-04 23:13:24,_trinityleah,,0,0,0,"Good ol West Milford, NJ! #BlackLivesMatter pic.twitter.com/Ff5tivdsdi",,,#BlackLivesMatter,1268682292475633664,https://twitter.com/_trinityleah/status/1268682292475633664
2020-06-04 23:13:23,jkakufo,,0,0,0,"To all the white people finding and posting messages from black people talking about love, patience, and kindness, please know if you're are only posting and listening to what makes you feel comfortable, you're not trying hard enough. #BlackLivesMatter",,,#BlackLivesMatter,1268682290168606722,https://twitter.com/jkakufo/status/1268682290168606722
2020-06-04 23:13:23,MargoTheWitchx,,0,0,0,"Imagine being silent about #blacklivesmatter because your boytoy with a footfetish wanna be a kkkop so bad. Couldn’t be me sis",,,#blacklivesmatter,1268682290080727043,https://twitter.com/MargoTheWitchx/status/1268682290080727043
2020-06-04 23:13:23,Laurie7McMillan,,0,0,1,"From someone who's no longer on the WPA-L but just read the archives: Thank you. Powerful recentering. Brought me to tears. #BlackLivesMatter @tosingofmyself --a role model for rhetorical bravery @Frankie_Condon @berniceM_Olivas @MaraLeeGrayson @ChicanaDra and many more",,@tosingofmyself @Frankie_Condon @berniceM_Olivas @MaraLeeGrayson @ChicanaDra,#BlackLivesMatter,1268682288470114304,https://twitter.com/Laurie7McMillan/status/1268682288470114304
2020-06-04 23:13:21,KateCantrell,juliaboccagno,0,0,0,"Washington, DC #dcprotest #BlackLivesMatter https:// twitter.com/juliaboccagno/ status/1268676796263825410 …",,,#dcprotest #BlackLivesMatter,1268682281817956354,https://twitter.com/KateCantrell/status/1268682281817956354
2020-06-04 23:13:21,sejalshah128,chakalaklavacca,0,0,2,"Humbled to have had the opportunity to show solidarity with the community today. Our patients matter, our communities matter, #blacklivesmatter #whitecoats4blacklives #sunydownstate https:// twitter.com/chakalaklavacc a/status/1268619365454188544 …",,,#blacklivesmatter #whitecoats4blacklives #sunydownstate,1268682281725628416,https://twitter.com/sejalshah128/status/1268682281725628416
2020-06-04 23:13:20,cesco527,K_dot_ali,1,0,3,"#blacklivesmatter #georgefloyd #BreonnaTaylor @julijays @shamwow712 @RaptorsGirl99 People I know that won’t break the chain",,@julijays @shamwow712 @RaptorsGirl99,#blacklivesmatter #georgefloyd #BreonnaTaylor,1268682276713500675,https://twitter.com/cesco527/status/1268682276713500675
2020-06-04 23:13:20,Really63518597,LACaldwellDC,0,0,0,"I just lost the last shred of respect for #TrumpEnabler @MittRomney #VoteOutHate #VoteOutTheGOP #ImpeachBarr #AmericaOrTrump #NoJusticeNoPeace #WeShallOvercome #GoJoe2020 #BlueTsunami2020 #BlackLivesMatter https:// twitter.com/lacaldwelldc/s tatus/1268552005301264386 …",,@MittRomney,#TrumpEnabler #VoteOutHate #VoteOutTheGOP #ImpeachBarr #AmericaOrTrump #NoJusticeNoPeace #WeShallOvercome #GoJoe2020 #BlueTsunami2020 #BlackLivesMatter,1268682275874500608,https://twitter.com/Really63518597/status/1268682275874500608
2020-06-04 23:13:19,jasmellev,mistiewebb00,0,0,0,"A year and a half ago you were still old enough to know what you are saying. I bet you think #BlackLivesMatter is a trend because saying the n word with the hard r shouldn’t be forgiven nor forgotten",,,#BlackLivesMatter,1268682274809106432,https://twitter.com/jasmellev/status/1268682274809106432
2020-06-04 23:13:19,TheSamBrock,JSMiller7492,0,0,2,"#blacklivesmatter This right here! https:// twitter.com/JSMiller7492/s tatus/1268681305987915783 …",,,#blacklivesmatter,1268682272993161216,https://twitter.com/TheSamBrock/status/1268682272993161216
2020-06-04 23:13:19,MLK_Not_Jr,videbeats,0,0,0,"Does #blacklivesmatter count? pic.twitter.com/KuUN98KKpJ",,,#blacklivesmatter,1268682272988958722,https://twitter.com/MLK_Not_Jr/status/1268682272988958722
2020-06-04 23:13:19,EricZHowell,,0,1,0,"We Believe In What’s Right! #BlackLivesMatter @uninterrupted pic.twitter.com/cMDYKm2c1o",,@uninterrupted,#BlackLivesMatter,1268682272649039873,https://twitter.com/EricZHowell/status/1268682272649039873
2020-06-04 23:13:19,llllleres,,0,0,0,"With everything going on do not forget to take a moment to relax, self care is important. You cannot care for anyone if you don’t care for yourself #blacklivesmatter",,,#blacklivesmatter,1268682272317878277,https://twitter.com/llllleres/status/1268682272317878277
2020-06-04 23:13:19,EaglesNationTX,,0,1,1,"I don’t have to talk on race. If folks don’t know my stance you don’t know me. #BlackLivesmatter #FuckthePolice",,,#BlackLivesmatter #FuckthePolice,1268682271827070984,https://twitter.com/EaglesNationTX/status/1268682271827070984
2020-06-04 23:13:19,EliasBarajas07,,0,1,2,"Wait so we all dropped out and still graduated ? #ClassOf2020 #COVIDー19 #BlackLivesMatter pic.twitter.com/KqNIcaPWRe – at Mission Oak High School",,,#ClassOf2020 #COVIDー19 #BlackLivesMatter,1268682271386505217,https://twitter.com/EliasBarajas07/status/1268682271386505217
2020-06-04 23:13:18,Chawlina01,Sae_0098,0,0,0,"- reply with #BlackLivesMatter #blacklifematters - do the same and tag 6 people @macchanbts @onulzet @Atimmii @keichiizu @ponpokirin @luleejpp",,@macchanbts @onulzet @Atimmii @keichiizu @ponpokirin @luleejpp,#BlackLivesMatter #blacklifematters,1268682270283571200,https://twitter.com/Chawlina01/status/1268682270283571200
2020-06-04 23:13:18,CaxtonLegal,,0,0,0,"If you are protesting in Queensland this weekend Caxton publishes two pieces of legal information that may be of interest. Read Police Powers - Your rights together with factsheet Policing in Qld during the Covid-19 Pandemic. #blacklivesmatter Here: https:// queenslandlawhandbook.org.au/factsheets-and -self-help-kits/ … pic.twitter.com/MwpbdZPwVs",,,#blacklivesmatter,1268682269444599809,https://twitter.com/CaxtonLegal/status/1268682269444599809
2020-06-04 23:13:18,opAZ01,rulajebreal,0,0,0,". all you dc protestors, be sure to bring along wire cutters. it will come in handy. . #BlackLivesMatterDC #BlackLivesMatter https:// twitter.com/rulajebreal/st atus/1268639049415380995 …",,,#BlackLivesMatterDC #BlackLivesMatter,1268682268303740928,https://twitter.com/opAZ01/status/1268682268303740928
2020-06-04 23:13:17,UratoCarol,LeniDiamond,0,0,1,"That’s “shoot them in the leg” Joe for you. No surprise. We know what he stands for and what he believes and it isn’t BLM. #BlackLivesMatter https:// twitter.com/lenidiamond/st atus/1268681456651366400 …",,,#BlackLivesMatter,1268682265531502592,https://twitter.com/UratoCarol/status/1268682265531502592
2020-06-04 23:13:17,asap_mayno,,0,0,1,"Candace Owens is just a black version of Tomi Lahren and all these racist ass folks be using her as an excuse to demean the #BlackLivesMatter movement. Smh y’all wack. On God.",,,#BlackLivesMatter,1268682263673405440,https://twitter.com/asap_mayno/status/1268682263673405440
2020-06-04 23:13:16,Temet21,,1,5,19,"Why are these quotes from my people STILL relevant? #BlackLivesMatter pic.twitter.com/nU0PM62v5N",,,#BlackLivesMatter,1268682260322021376,https://twitter.com/Temet21/status/1268682260322021376
2020-06-04 23:13:16,mathiaslee,TheRevAl,0,0,0,"THANK YOU Reverend Al for a truly moving and inspirational eulogy for George Floyd. You helped restore my faith that we will come out of all of this a better people and country. #BlackLivesMatter",,,#BlackLivesMatter,1268682259546030080,https://twitter.com/mathiaslee/status/1268682259546030080
2020-06-04 23:13:16,TimeStopper,ResisterSerena,0,0,0,"Shit, can we get more good things on board with #BlackLivesMatter ? Maybe all the stupid racist will finally go back into the holes they crawled out of and stop giving all of us Corona. #2020Protests #FuckMAGA #Bunkerbaby #SocialDistanacing https:// twitter.com/ResisterSerena /status/1268007497018650625 …",,,#BlackLivesMatter #2020Protests #FuckMAGA #Bunkerbaby #SocialDistanacing,1268682258484871168,https://twitter.com/TimeStopper/status/1268682258484871168
2020-06-04 23:13:16,EduGladiators,,0,1,1,"Join #EduGladiators SATURDAY to discuss the power & history of #protest + how YOU can join the fight to eradicate racism! #BlackLivesMatter #RacismInAmerica @Rdene915 @PaulONeill1972 @D4Griffin3 @BrendanFetters @Maverikedu12 @mccoyderek @SeanAThom @cskiles80 @DrJohnTharp pic.twitter.com/mePj6Vj66E",,@Rdene915 @PaulONeill1972 @D4Griffin3 @BrendanFetters @Maverikedu12 @mccoyderek @SeanAThom @cskiles80 @DrJohnTharp,#EduGladiators #protest #BlackLivesMatter #RacismInAmerica,1268682258338152448,https://twitter.com/EduGladiators/status/1268682258338152448
2020-06-04 23:13:15,AmusingA_hole,,0,0,0,"I demand that all black people apologize for the daily Nigerian scam emails. #stupid #BlackLivesMatter #LiberalismIsAMentalDisorder",,,#stupid #BlackLivesMatter #LiberalismIsAMentalDisorder,1268682257687932928,https://twitter.com/AmusingA_hole/status/1268682257687932928
2020-06-04 23:13:15,ElyssaKaufman,,0,0,1,"Crowds gather at the #blacklivesmatter protest in Buffalo Grove. Photo credit: Carly Newman pic.twitter.com/7TWo4Goqdt",,,#blacklivesmatter,1268682255733587968,https://twitter.com/ElyssaKaufman/status/1268682255733587968
2020-06-04 23:13:14,kellywinnnn,,0,0,1,"Had to post this on Facebook to get my Asian relatives some insight on #BlackLivesMatter protests. pic.twitter.com/3L4BYKr0Ky",,,#BlackLivesMatter,1268682253409882115,https://twitter.com/kellywinnnn/status/1268682253409882115
2020-06-04 23:13:14,SmartLinx,,0,0,0,"SmartLinx CEO, Marina Aslanyan, responds to recent events and emphasizes the power of diversity to advance our common goals and improve society. Read her full response below. #leadership , #blacklivesmatter pic.twitter.com/tEg8HOsyd8",,,#leadership #blacklivesmatter,1268682253279932420,https://twitter.com/SmartLinx/status/1268682253279932420
2020-06-04 23:13:13,AutocratTactics,,0,0,0,"be aware that you chose the side of the tyrant King George III, not the American patriots. #BlackLivesMatter “",,,#BlackLivesMatter,1268682249102405634,https://twitter.com/AutocratTactics/status/1268682249102405634
2020-06-04 23:13:13,julessz71,,0,0,0,"This still happening! This cop draws gun on driver for not using turn signal, and gets a lecture #BlackLivesMatter https:// m.facebook.com/story.php?stor y_fbid=10216631126754019&id=1335553682&sfnsn=mo&d=n&vh=i …",,,#BlackLivesMatter,1268682246292004864,https://twitter.com/julessz71/status/1268682246292004864
2020-06-04 23:13:12,TheJayCalledLee,,0,0,0,"Coronavirus in Kenya: Probe ordered into shooting of 13-year-old https:// youtu.be/jResNmzPjQw via @YouTube #Blacklivesmatter don’t care - no color angle - they are too poor to worry about",,@YouTube,#Blacklivesmatter,1268682242068566018,https://twitter.com/TheJayCalledLee/status/1268682242068566018
2020-06-04 23:13:11,GiannaMehes,,0,0,0,"Marchers from Bergen County Courthouse arrive at Hackensack City Hall Complex #BLMprotest #BlackLivesMatter #Hackensack pic.twitter.com/OACWPXKuPP",,,#BLMprotest #BlackLivesMatter #Hackensack,1268682240491470852,https://twitter.com/GiannaMehes/status/1268682240491470852
2020-06-04 23:13:11,DetectiveEna,,0,0,0,"I just took action to support black lives and demand police accountability. Click to do the same: https:// p2a.co/X3lzOXH #BlackLivesMatter",,,#BlackLivesMatter,1268682238557925378,https://twitter.com/DetectiveEna/status/1268682238557925378
2020-06-04 23:13:11,Jlaurenwriter,,0,0,0,"Black community: I hear you, I see you, I stand with you. I want to understand and do better. I want to raise my children better. #BlackLivesMatter",,,#BlackLivesMatter,1268682238163443712,https://twitter.com/Jlaurenwriter/status/1268682238163443712
2020-06-04 23:13:10,MarcusShepard,,0,1,0,"How does @Uber stand with #BlackLivesMatter but you’re shutting down your service at 8pm due to the curfew? Wouldn’t it make sense to still be out to help protestors get home. pic.twitter.com/fGFe5djuoj",,@Uber,#BlackLivesMatter,1268682235567378432,https://twitter.com/MarcusShepard/status/1268682235567378432
2020-06-04 23:13:10,infinitynbiondo,richardgrant88,0,0,0,"if this image doesn’t haunt you, you’re aiding the injustice #BlackLivesMatter https:// twitter.com/richardgrant88 /status/1267523353289474048 …",,,#BlackLivesMatter,1268682233495212032,https://twitter.com/infinitynbiondo/status/1268682233495212032
2020-06-04 23:13:09,KikiStar_,jjk1now,0,2,4,"Land of the F-Power, they love to watch us cower. Is this the freedom we were promised? #blacklivesmatter https:// twitter.com/jjk1now/status /1268185125675810817 …",,,#blacklivesmatter,1268682231247261696,https://twitter.com/KikiStar_/status/1268682231247261696
2020-06-04 23:13:09,GlennTaylorBook,,1,0,1,"Marching from High Street, #Morgantown #WV 6.4.2020 Listen to @officialdaniwv WV got your back, Danielle. We know a true leader when we hear one. Dismantle white supremacy. #HopeDiesLast #BlackLivesMatter One Love. pic.twitter.com/3p7nEYCW5K",,@officialdaniwv,#Morgantown #WV #HopeDiesLast #BlackLivesMatter,1268682230903300097,https://twitter.com/GlennTaylorBook/status/1268682230903300097
2020-06-04 23:13:09,automanyeeyee,realpatriot78,0,0,0,"i never said anything about that??? my whole point is that #blacklivesmatter , so please explain if this is an insult or not... black on black crime happens, white on white crime happens, so the whole world is fucked up, basically.",,,#blacklivesmatter,1268682229934415875,https://twitter.com/automanyeeyee/status/1268682229934415875
2020-06-04 23:13:08,xBruci,,0,0,0,"“wOuLd ThEy sO uPsEt iF iT hAd BeEn A wHiTe PeRsOn?” YES, you fucking buffoon. #BlackLivesMatter supporters speak out against police brutality for NUMEROUS races & genders. It just so happens that George was the final straw and we in the black community are especially FED UP!",,,#BlackLivesMatter,1268682227472310272,https://twitter.com/xBruci/status/1268682227472310272
2020-06-04 23:13:08,MattJCuff,,0,0,0,"@BBCNews 'after an officer allegedly knelt on his neck' are you serious?! That is disgusting. How dare you say 'allegedly'. It happened and we will all fight against racial injustice. It must stop. We are united together. #GeorgeFloyd #blacklivesmatter pic.twitter.com/gIpnjoZNxE",,@BBCNews,#GeorgeFloyd #blacklivesmatter,1268682227401068544,https://twitter.com/MattJCuff/status/1268682227401068544
2020-06-04 23:13:07,IdkKelseyH,,0,0,0,"the fact of the matter is none of us white people will EVER face oppression because of the color of our skin. that IS white privilege, just one of many aspects of it. if you cannot see this, you are not paying attention. plain and simple #BlackLivesMatter",,,#BlackLivesMatter,1268682224590893059,https://twitter.com/IdkKelseyH/status/1268682224590893059
2020-06-04 23:13:07,TyeAryeh,,0,0,0,"GET YOUR BLUE KNEE OFF ALL OUR NECKS #NoJusticeNoPeace #DefundThePolice #BlackLivesMatter #GeorgeFloyd #BLMprotest #ICantBreathe #JusticeforGeorgesFloyd #Repost #BLM #bunkerbitch #LGBTQ #TransLivesMatter #LGBT",,,#NoJusticeNoPeace #DefundThePolice #BlackLivesMatter #GeorgeFloyd #BLMprotest #ICantBreathe #JusticeforGeorgesFloyd #Repost #BLM #bunkerbitch #LGBTQ #TransLivesMatter #LGBT,1268682222464143360,https://twitter.com/TyeAryeh/status/1268682222464143360
2020-06-04 23:13:07,jessylynn40,senatemajldr,0,0,0,"And you bring this up why? This is the @gop plan to scare people to stay home? #BlackLivesMatter",,@gop,#BlackLivesMatter,1268682222346702848,https://twitter.com/jessylynn40/status/1268682222346702848
2020-06-04 23:13:07,therealbilllium,,0,0,0,"All the white people sharing the @RealCandaceO video all over my Facebook tells me all I need to know. #BlackLivesMatter",,@RealCandaceO,#BlackLivesMatter,1268682222153973763,https://twitter.com/therealbilllium/status/1268682222153973763
2020-06-04 23:13:06,m0therc0c0nuts,,0,0,1,"YES OMG #BLACKLIVESMATTER pic.twitter.com/ONp5ZjKUeV",,,#BLACKLIVESMATTER,1268682218618195972,https://twitter.com/m0therc0c0nuts/status/1268682218618195972
2020-06-04 23:13:05,ccasarico,,0,0,0,"I just watched a beautiful speech by James Cordon of The Late Late Show on George Floyd and police brutality. He’s a man with an audience, and he’s using it. Add your voice. If you don’t protest, sign petitions. Donate if you can. Because #blacklivesmatter and they always have.",,,#blacklivesmatter,1268682215195660293,https://twitter.com/ccasarico/status/1268682215195660293
2020-06-04 23:13:05,IP_Sidhu,MsAvaArmstrong,0,0,0,"@KingJames #BlackLivesMatter what you have to say ? @SenateGOP @realDonaldTrump @PressSec @DOJPH #KAGA2020 https:// twitter.com/msavaarmstrong /status/1268663326256640004 …",,@KingJames @SenateGOP @realDonaldTrump @PressSec @DOJPH,#BlackLivesMatter #KAGA2020,1268682214364962819,https://twitter.com/IP_Sidhu/status/1268682214364962819
2020-06-04 23:13:05,zcmart,BrianPHickey,0,0,0,"It is unconstitutional for him to do so. Commissioner Gale strongly defended his ""statement"" regarding #blacklivesmatter as free speech under the First Amendment today. When public officials block critics on social media, it is unconstitutional. #aclu",,,#blacklivesmatter #aclu,1268682213891153921,https://twitter.com/zcmart/status/1268682213891153921
2020-06-04 23:13:04,NikolaiSerban,,0,0,0,"@EugeneGayPride this year's pride, while obviously needing to be safe, should be a #BlackTransLivesMatter Solidarity March , like @lapride is doing. #BlackLivesMatter #eugeneprotest",,@EugeneGayPride @lapride,#BlackTransLivesMatter #BlackLivesMatter #eugeneprotest,1268682209914875904,https://twitter.com/NikolaiSerban/status/1268682209914875904
2020-06-04 23:13:04,TrueBoots,,0,2,4,"Coming up 4th Ave time now. Join us. Justice for #jamelfloyd . #blacklivesmatter pic.twitter.com/Jkz8OE9ynj",,,#jamelfloyd #blacklivesmatter,1268682209810165760,https://twitter.com/TrueBoots/status/1268682209810165760
2020-06-04 23:13:04,nuedele,,1,0,0,"I am very surprised that the #beyhive online spaming tactic has not been adoptes yet. I am just saying. #blacklivesmatter",,,#beyhive #blacklivesmatter,1268682208841281537,https://twitter.com/nuedele/status/1268682208841281537
2020-06-04 23:13:03,BTSMEMEQUEEN,,0,0,0,"My man @CAM3R0NPH1L1P is doing a live stream fundraiser for #BlackLivesMatter Love this man! https:// youtu.be/H8Z9Q2C_tl8",,@CAM3R0NPH1L1P,#BlackLivesMatter,1268682205921980418,https://twitter.com/BTSMEMEQUEEN/status/1268682205921980418
2020-06-04 23:13:03,theKYingredient,,0,0,1,"I pray for the white person that decides to go to my mama house because they don’t agree with #BlackLivesMatter . And they better hope my grandfather is sleep",,,#BlackLivesMatter,1268682204512751616,https://twitter.com/theKYingredient/status/1268682204512751616
2020-06-04 23:13:02,GoodVibezOwnLee,,0,0,0,"Re-open ALL CASES related to black lives being taken by police brutality #BlackLivesMatter",,,#BlackLivesMatter,1268682201337524224,https://twitter.com/GoodVibezOwnLee/status/1268682201337524224
2020-06-04 23:13:01,MrFettToYou76,,0,1,1,"Seriously just get it together! #justiceforgeorgefloyd #fourmurderersincustody ##getyourshittogetheramerica #rickandmorty #ittakesallofus #blacklivesmatter #bunkerbitchtrump #justinspectingthebunkerriiight pic.twitter.com/mmj3fkY5JF",,,#justiceforgeorgefloyd #fourmurderersincustody # #getyourshittogetheramerica #rickandmorty #ittakesallofus #blacklivesmatter #bunkerbitchtrump #justinspectingthebunkerriiight,1268682198598778884,https://twitter.com/MrFettToYou76/status/1268682198598778884
2020-06-04 23:13:01,PunchPlanet,,0,0,0,"#PunchPlanet Thursdays hosted by @swiftimus kicks off at 7pm CT> https://www. twitch.tv/swiftimustv Test your might against the 2019 #evo champ @CoreAGaming ! Co-Commentator @bonesawbaker will be donating $10 to Campaign Zero for everyone who plays in tonights Weekly #BlackLivesMatter",,@swiftimus @CoreAGaming @bonesawbaker,#PunchPlanet #evo #BlackLivesMatter,1268682198439387136,https://twitter.com/PunchPlanet/status/1268682198439387136
2020-06-04 23:13:01,_danso1o,,0,0,0,"Take that kneel and stop talking #blackLivesMatter",,,#blackLivesMatter,1268682197613101057,https://twitter.com/_danso1o/status/1268682197613101057
2020-06-04 23:13:01,dangelno,,3,55,330,"i tried to donate one dollar for #blacklivesmatter for every generic donation-less PR statement i saw from a celebrity, but then i realized i'm not bill gates close enough, and on a serious note i couldn't have done this without people watching my videos so thank you <3 pic.twitter.com/Tk9sDTdcXd",,,#blacklivesmatter,1268682196329672705,https://twitter.com/dangelno/status/1268682196329672705
2020-06-04 23:13:01,RainInshooky,,1,0,1,"END QUALIFIED IMMUNITY. It protects cops from serving jail time. I love this man. #Blacklivesmatter Here are some things we all have to get behind to end this. pic.twitter.com/le37k6E7Rm",,,#Blacklivesmatter,1268682196048543744,https://twitter.com/RainInshooky/status/1268682196048543744
2020-06-04 23:12:59,oliviavonopel,,0,0,0,"Andy Beshear: Justice for Breonna Taylor - Sign the Petition! http:// chng.it/JhrYvdj2 via @Change #SayHerName #BreonnaTaylor #blacklivesmatter",,@Change,#SayHerName #BreonnaTaylor #blacklivesmatter,1268682191124512769,https://twitter.com/oliviavonopel/status/1268682191124512769
2020-06-04 23:12:59,GmanTavern,,0,2,2,"Hey North side + #Wrigleysville fam! We’re hosting a food and supply drive tomorrow and Saturday for We Got Us! Benefitting families on the West and South side. Bring what you can, Friday and Saturday between 2pm-7pm! #BlackLivesMatter #WeGotUs pic.twitter.com/yUpoOsNFTa",,,#Wrigleysville #BlackLivesMatter #WeGotUs,1268682187957829632,https://twitter.com/GmanTavern/status/1268682187957829632
2020-06-04 23:12:59,onyxgod32,Prez,0,0,0,"@NFL , @FrommJake should be at the very least suspended for several games, if not bounced from the league for this blatantly white supremacist statement. #BLACKLIVESMATTER @TiffanyDCross",,@NFL @FrommJake @TiffanyDCross,#BLACKLIVESMATTER,1268682187567706116,https://twitter.com/onyxgod32/status/1268682187567706116
2020-06-04 23:12:57,RemixRK,jdice03,0,0,0,"Couldn’t be said any better honestly #blacklivesmatter https:// twitter.com/jdice03/status /1268607829839151107 …",,,#blacklivesmatter,1268682181892767744,https://twitter.com/RemixRK/status/1268682181892767744
2020-06-04 23:12:57,Carmelitaa___,,0,0,2,"San Francisco was an unforgettable experience. Thank you Univision for giving my voice a platform to be heard by the Latino community. Let's keep coming together to help fight injustices in this country. #BlackLivesMatter #BlackLOVEBrownPRIDE #sfprotest pic.twitter.com/es55wu6IU2",,,#BlackLivesMatter #BlackLOVEBrownPRIDE #sfprotest,1268682180663767040,https://twitter.com/Carmelitaa___/status/1268682180663767040
2020-06-04 23:12:56,MrKookies,MrKookies,0,2,0,"DNA and Jess raised over £500+ in 3 hours playing pop music! FLIPPING AMAZING #POPInOurDNA #Justice4BellyMujinga #BlackLivesMatter Charities C’mon!!!!! https:// twitter.com/MrKookies/stat us/1268648628077441031 …",,,#POPInOurDNA #Justice4BellyMujinga #BlackLivesMatter,1268682178520666113,https://twitter.com/MrKookies/status/1268682178520666113
2020-06-04 23:12:56,MemeDreamer5,,0,0,0,"@realDonaldTrump it's truly THIS simple. One question.. What would it take for YOU to be okay with a cop killing or brutalizing someone YOU love? #NoJusticeNoPeaceProsecuteThePolice #BlackLivesMatter pic.twitter.com/WKqkLeMktA",,@realDonaldTrump,#NoJusticeNoPeaceProsecuteThePolice #BlackLivesMatter,1268682177929113600,https://twitter.com/MemeDreamer5/status/1268682177929113600
2020-06-04 23:12:56,rjortiz4l,,1,1,3,"good protest in my community today. crowd blocking traffic chanting “we gon be alright.” by @kendricklamar #blacklivesmatter pic.twitter.com/a4xNF09kf3",,@kendricklamar,#blacklivesmatter,1268682176348016640,https://twitter.com/rjortiz4l/status/1268682176348016640
2020-06-04 23:12:56,bpchristine,A_kamara6,0,0,0,"Preach, Alvin!! So glad you’re a #VFL and a Saint! #blacklivesmatter https:// twitter.com/a_kamara6/stat us/1268650374736629765 …",,,#VFL #blacklivesmatter,1268682175362326528,https://twitter.com/bpchristine/status/1268682175362326528
2020-06-04 23:12:55,PSLchicago,,0,1,3,"Marilyn came out to the rally in New Lenox after her friend was racially profiled earlier today while shopping in a nearby town #BlackLivesMatter pic.twitter.com/CGqcLlBGr4",,,#BlackLivesMatter,1268682171952308225,https://twitter.com/PSLchicago/status/1268682171952308225
2020-06-04 23:12:54,michelleplatti,,0,8,8,"ALL the ad revenue that is made from this playlist of videos goes to organizations for the #BlackLivesMatter movement. if you do not have money to donate, this is the PERFECT and EASIEST way you can help with donations!!! BLM Stream Playlist https://www. youtube.com/playlist?list= PLjoFJxM7MGmFVbalEKN0QNBX06zKG9abR … via @YouTube",,@YouTube,#BlackLivesMatter,1268682169678954498,https://twitter.com/michelleplatti/status/1268682169678954498
